{
  "schema_version": 1,
  "application": "xfce-guacamole",
  "flavor": "disposable",
  "deployment": "prod",
  "application_commit": "0f1e2d3c4b5a69788796a5b4c3d2e1f009182736",
  "development_override": false,
  "status": "installed",
  "created_at": "2026-01-01T10:00:00Z",
  "bindings": {
    "guest": {
      "address": "cloudai:cloudify",
      "node": "cloudai",
      "instance": "cloudify",
      "ssh_host": null
    },
    "gateway": {
      "address": "cloudai",
      "node": "cloudai",
      "instance": null,
      "ssh_host": null
    }
  },
  "last_run_id": "20260101T101112Z-a1b2c3d4",
  "last_event_id": "20260101T101115Z-b2c3d4e5"
}
