{
  "schema_version": 1,
  "application": "k3s",
  "flavor": "default",
  "deployment": "default",
  "application_commit": "0f1e2d3c4b5a69788796a5b4c3d2e1f009182736",
  "development_override": false,
  "status": null,
  "created_at": "2026-01-01T10:00:00Z",
  "bindings": {
    "server": {
      "address": "cloudai:cloudify",
      "node": "cloudai",
      "instance": "cloudify",
      "ssh_host": null
    }
  },
  "last_run_id": null,
  "last_event_id": null
}
