{
  "schema_version": 1,
  "application": "hermes",
  "flavor": "default",
  "deployment": "staging-2",
  "application_commit": "0f1e2d3c4b5a69788796a5b4c3d2e1f009182736",
  "development_override": true,
  "status": "degraded",
  "created_at": "2026-02-28T23:59:59Z",
  "bindings": {
    "agent": {
      "address": "203.0.113.9",
      "node": null,
      "instance": null,
      "ssh_host": "203.0.113.9"
    }
  },
  "last_run_id": "20260228T235959Z-0a1b2c3d",
  "last_event_id": null
}
