{
  "schema_version": 1,
  "application": "xfce-guacamole",
  "flavor": "disposable",
  "deployment": "dev-box",
  "application_commit": null,
  "development_override": true,
  "status": null,
  "created_at": "2026-01-01T10:00:00Z",
  "bindings": {
    "guest": {
      "address": "cloudai:cloudify",
      "node": "cloudai",
      "instance": "cloudify",
      "ssh_host": null
    }
  },
  "last_run_id": null,
  "last_event_id": null
}
